[
  {
    "id": "p1.comprehension_set.passage-village-fair",
    "type": "comprehension_set",
    "paper": "1st",
    "topic": "seen_comprehension",
    "difficulty": "medium",
    "marks_weight": 6,
    "tags": [],
    "instruction_bn": "অনুচ্ছেদটি পড়ে নিচের প্রশ্নগুলোর উত্তর দাও",
    "explanation_bn": "প্রতিটি উপ-প্রশ্নের নিজস্ব ব্যাখ্যা নিচে দেওয়া আছে।",
    "review_status": "published",
    "author": "dev-sample",
    "data": {
      "passage_en": "Once a year, a big fair is held in Bishpur village. Villagers from nearby areas gather there to buy and sell various things. Toys, sweets, and handicrafts are sold at the fair. Folk singers perform songs, and children enjoy merry-go-rounds. The fair usually starts in the morning and continues till late evening. It brings joy and a sense of togetherness to the whole village.",
      "passage_source": "original",
      "sub_questions": [
        {
          "id": "q1",
          "type": "mcq",
          "data": {
            "question_en": "Where is the fair held?",
            "options": [
              {
                "key": "A",
                "text_en": "Bishpur village"
              },
              {
                "key": "B",
                "text_en": "Dhaka city"
              },
              {
                "key": "C",
                "text_en": "Chittagong"
              },
              {
                "key": "D",
                "text_en": "Sylhet"
              }
            ],
            "correct_option": "A"
          },
          "instruction_bn": "সঠিক উত্তর বেছে নাও",
          "explanation_bn": "অনুচ্ছেদের প্রথম বাক্যে গ্রামের নাম উল্লেখ আছে।"
        },
        {
          "id": "q2",
          "type": "fill_in_open",
          "data": {
            "sentence_en": "What do folk singers do at the fair?",
            "accepted_answers": [
              "perform songs",
              "sing songs",
              "sing"
            ],
            "fuzzy_tolerance": 2,
            "case_sensitive": false
          },
          "instruction_bn": "এক কথায় উত্তর লেখো",
          "explanation_bn": "অনুচ্ছেদে বলা হয়েছে, folk singers গান পরিবেশন করেন।"
        }
      ]
    }
  },
  {
    "id": "p1.rearranging.rearr-01",
    "type": "rearranging",
    "paper": "1st",
    "topic": "rearranging_sentences",
    "difficulty": "medium",
    "marks_weight": 2,
    "tags": [],
    "instruction_bn": "বাক্যগুলোকে সঠিক ক্রমে সাজাও",
    "explanation_bn": "একটি অনুচ্ছেদের বাক্যগুলো সময়ের ক্রম (order of events) অনুসারে সাজাতে হয়।",
    "review_status": "published",
    "author": "dev-sample",
    "data": {
      "unit_type": "sentence",
      "units": [
        {
          "id": "U1",
          "text_en": "Yesterday it rained heavily in Dhaka."
        },
        {
          "id": "U2",
          "text_en": "The streets were flooded with water."
        },
        {
          "id": "U3",
          "text_en": "Many people faced difficulty going to work."
        },
        {
          "id": "U4",
          "text_en": "By evening, the rain finally stopped."
        }
      ],
      "correct_order": [
        "U1",
        "U2",
        "U3",
        "U4"
      ]
    }
  },
  {
    "id": "p2.fill_in_open.rfv-01",
    "type": "fill_in_open",
    "paper": "2nd",
    "topic": "right_form_of_verb",
    "difficulty": "hard",
    "marks_weight": 1,
    "tags": [],
    "instruction_bn": "বন্ধনীর ক্রিয়াপদের সঠিক রূপ লেখো",
    "explanation_bn": "শর্তসাপেক্ষ (conditional) বাক্যে 'if' এর পর কাল্পনিক অবস্থা বোঝাতে 'were' ব্যবহার হয়, 'was' নয়।",
    "review_status": "published",
    "author": "dev-sample",
    "data": {
      "sentence_en": "If I ___ (be) you, I would study harder.",
      "accepted_answers": [
        "were"
      ],
      "fuzzy_tolerance": 0,
      "case_sensitive": false
    }
  },
  {
    "id": "p2.fill_in_open.rfv-02",
    "type": "fill_in_open",
    "paper": "2nd",
    "topic": "right_form_of_verb",
    "difficulty": "medium",
    "marks_weight": 1,
    "tags": [],
    "instruction_bn": "বন্ধনীর ক্রিয়াপদের সঠিক রূপ লেখো",
    "explanation_bn": "Present Perfect Tense-এ verb-এর V3 (past participle) রূপ ব্যবহার হয়।",
    "review_status": "published",
    "author": "dev-sample",
    "data": {
      "sentence_en": "She has ___ (finish) her assignment already.",
      "accepted_answers": [
        "finished"
      ],
      "fuzzy_tolerance": 1,
      "case_sensitive": false
    }
  },
  {
    "id": "p2.fill_in_open.rfv-03",
    "type": "fill_in_open",
    "paper": "2nd",
    "topic": "right_form_of_verb",
    "difficulty": "hard",
    "marks_weight": 1,
    "tags": [],
    "instruction_bn": "বন্ধনীর ক্রিয়াপদের সঠিক রূপ লেখো",
    "explanation_bn": "Passive Voice-এ Past Simple বোঝাতে 'was/were + V3' ব্যবহার হয়।",
    "review_status": "published",
    "author": "dev-sample",
    "data": {
      "sentence_en": "The Padma Bridge ___ (build) in 2022.",
      "accepted_answers": [
        "was built"
      ],
      "fuzzy_tolerance": 1,
      "case_sensitive": false
    }
  },
  {
    "id": "p2.fill_in_word_bank.prep-fiwb-01",
    "type": "fill_in_word_bank",
    "paper": "2nd",
    "topic": "preposition",
    "difficulty": "easy",
    "marks_weight": 1,
    "tags": [],
    "instruction_bn": "শব্দভাণ্ডার থেকে সঠিক preposition বেছে খালি ঘর পূরণ করো",
    "explanation_bn": "'Good at' একটি fixed preposition phrase, দক্ষতা বোঝাতে ব্যবহৃত হয়।",
    "review_status": "published",
    "author": "dev-sample",
    "data": {
      "sentence_en": "He is good {{1}} mathematics.",
      "word_bank": [
        "at",
        "in",
        "on",
        "of"
      ],
      "blanks": [
        {
          "blank_id": "1",
          "correct_answer": "at"
        }
      ]
    }
  },
  {
    "id": "p2.fill_in_word_bank.prep-fiwb-02",
    "type": "fill_in_word_bank",
    "paper": "2nd",
    "topic": "preposition",
    "difficulty": "medium",
    "marks_weight": 1,
    "tags": [],
    "instruction_bn": "শব্দভাণ্ডার থেকে সঠিক preposition বেছে খালি ঘর পূরণ করো",
    "explanation_bn": "'Famous for' একটি fixed preposition phrase, কোনো কিছুর জন্য পরিচিতি বোঝাতে ব্যবহৃত হয়।",
    "review_status": "published",
    "author": "dev-sample",
    "data": {
      "sentence_en": "Dhaka is famous {{1}} its rich culture.",
      "word_bank": [
        "for",
        "of",
        "with",
        "about"
      ],
      "blanks": [
        {
          "blank_id": "1",
          "correct_answer": "for"
        }
      ]
    }
  },
  {
    "id": "p2.fill_in_word_bank.tense-fiwb-01",
    "type": "fill_in_word_bank",
    "paper": "2nd",
    "topic": "tense",
    "difficulty": "easy",
    "marks_weight": 1,
    "tags": [],
    "instruction_bn": "শব্দভাণ্ডার থেকে সঠিক শব্দ বেছে খালি ঘর পূরণ করো",
    "explanation_bn": "নিয়মিত/অভ্যাসগত কাজ বোঝাতে Present Indefinite Tense (verb + s/es) ব্যবহার হয়।",
    "review_status": "published",
    "author": "dev-sample",
    "data": {
      "sentence_en": "She {{1}} to school every day.",
      "word_bank": [
        "goes",
        "go",
        "going",
        "gone"
      ],
      "blanks": [
        {
          "blank_id": "1",
          "correct_answer": "goes"
        }
      ]
    }
  },
  {
    "id": "p2.fill_in_word_bank.tense-fiwb-02",
    "type": "fill_in_word_bank",
    "paper": "2nd",
    "topic": "tense",
    "difficulty": "medium",
    "marks_weight": 1,
    "tags": [],
    "instruction_bn": "শব্দভাণ্ডার থেকে সঠিক শব্দ বেছে খালি ঘর পূরণ করো",
    "explanation_bn": "অতীতে চলমান একটি কাজ বোঝাতে Past Continuous Tense (was/were + V-ing) ব্যবহার হয়।",
    "review_status": "published",
    "author": "dev-sample",
    "data": {
      "sentence_en": "They {{1}} football when it started to rain.",
      "word_bank": [
        "played",
        "were playing",
        "play",
        "plays"
      ],
      "blanks": [
        {
          "blank_id": "1",
          "correct_answer": "were playing"
        }
      ]
    }
  },
  {
    "id": "p2.flashcard.vocab-01",
    "type": "flashcard",
    "paper": "2nd",
    "topic": "vocabulary_hsc_words",
    "difficulty": "medium",
    "marks_weight": 1,
    "tags": [],
    "instruction_bn": "শব্দটির অর্থ ও ব্যবহার শেখো",
    "explanation_bn": "Abundant একটি বিশেষণ (adjective), অর্থ 'প্রচুর'।",
    "review_status": "published",
    "author": "dev-sample",
    "data": {
      "front_en": "Abundant",
      "back_bn": "প্রচুর",
      "example_sentence_en": "Bangladesh has abundant water resources.",
      "part_of_speech": "adjective",
      "synonym": "plentiful",
      "antonym": "scarce"
    }
  },
  {
    "id": "p2.flashcard.vocab-02",
    "type": "flashcard",
    "paper": "2nd",
    "topic": "vocabulary_hsc_words",
    "difficulty": "medium",
    "marks_weight": 1,
    "tags": [],
    "instruction_bn": "শব্দটির অর্থ ও ব্যবহার শেখো",
    "explanation_bn": "Diligent একটি বিশেষণ, অর্থ 'পরিশ্রমী'।",
    "review_status": "published",
    "author": "dev-sample",
    "data": {
      "front_en": "Diligent",
      "back_bn": "পরিশ্রমী",
      "example_sentence_en": "A diligent student never wastes time.",
      "part_of_speech": "adjective",
      "synonym": "hardworking",
      "antonym": "lazy"
    }
  },
  {
    "id": "p2.flashcard.vocab-03",
    "type": "flashcard",
    "paper": "2nd",
    "topic": "vocabulary_hsc_words",
    "difficulty": "medium",
    "marks_weight": 1,
    "tags": [],
    "instruction_bn": "শব্দটির অর্থ ও ব্যবহার শেখো",
    "explanation_bn": "Reluctant একটি বিশেষণ, অর্থ 'অনিচ্ছুক'।",
    "review_status": "published",
    "author": "dev-sample",
    "data": {
      "front_en": "Reluctant",
      "back_bn": "অনিচ্ছুক",
      "example_sentence_en": "He was reluctant to answer the question.",
      "part_of_speech": "adjective",
      "synonym": "unwilling",
      "antonym": "eager"
    }
  },
  {
    "id": "p2.flashcard.vocab-04",
    "type": "flashcard",
    "paper": "2nd",
    "topic": "vocabulary_hsc_words",
    "difficulty": "easy",
    "marks_weight": 1,
    "tags": [],